{
  "scenarioType": "Flexible Scenario",
  "map": {
    "initializerType": "Simple Map",
    "cellSizeInKilometers": 10,
    "width": 50,
    "height": 50
  },
  "biology": {
    "initializerType": "Single Species Biomass",
    "species": [
      {
        "name": "Species 0",
        "modelType": "biomass",
        "carryingCapacity": 5000
      }
    ]
  },
  "fleet": {
    "fishers": [
      {
        "name": "fleet-0",
        "count": 50,
        "gear": {
          "type": "Random Catchability"
        }
      }
    ]
  }
}